raw_id,idAbonnement,idFournisseur,titreAbonnement,descriptionAbonnement,prixAbonnement,categorieAbonnement,date_extraction,source_system
1,ABN00001,FRN0014,La liberté de rouler avant-tout,Sac rester assurer oublier malgré puissance. Avec cuisine lutter bon défendre. Contenir mal désir paraître conclure race.,95.59,Cloud Storage,2025-05-21 22:47:18,Manual_Entry
2,ABN00002,FRN0022,L'avantage de changer sans soucis,"Fenêtre mer quelqu'un expliquer ici. À angoisse droite afin de chaîne succès. Élément d'autres sien.
Tête longtemps morceau mort bien.",40.4,FORFAIT APPEL CONX,2025-03-06 22:22:07,Mobile_App_v2
3,ABN00003,FRN0010,L'art d'évoluer avant-tout,Chien plein vraiment vide rang. Ligne d'autres eaux fonder cerveau baisser mort. Mener dire fort.,10,CLOUD,2025-04-01 06:45:37,Mobile_App_v2
4,ABN00004,FRN0012,Le confort de louer sans soucis,"Chat appuyer rouler couler faveur rassurer seulement cacher. Dernier pain chef. Adresser pourquoi ça hôtel ailleurs.
Crier même raison mensonge papa voler pourtant. Ferme tantôt mal.",85,CLOUD,2025-01-04 16:54:41,CRM_System
5,ABN00005,FRN0027,Programmable attitude-oriented model,Early piece professional protect. Something fine apply gas sing light mention. Off former good within far cold reason. See risk nor article list college appear wrong.,98,streaming,2025-03-22 04:28:35,Manual_Entry
6,ABN00006,FRN0006,La possibilité d'avancer avant-tout,Manquer consentir lèvre immobile tôt aider désespoir malheur. Juste quelqu'un agent politique examiner éloigner. Double attention devoir fixe yeux voiture triste.,EUR 93.26,Cloud Storage,2025-03-16 09:41:15,Mobile_App_v2
7,ABN00007,FRN0003,Front-line stable intranet,"Official success approach enough standard. Cold human feeling.
Here relationship listen certain that. Eye something high. Which raise American truth PM what.",38.35 €,Cloud Storage,2025-01-26 14:06:09,Manual_Entry
8,ABN00008,FRN0006,Open-source bandwidth-monitored moderator,"Goal rise edge alone people arm order. Wear point remain build task.
Prevent tonight not whose to receive. Far produce away law yet.",EUR 55.4,CLOUD,2025-02-20 07:00:36,Manual_Entry
9,ABN00009,FRN0025,Customer-focused 5thgeneration archive,"Road since affect marriage present a also. Entire record toward off middle vote.
Job such sit size music about west. Building movement yard four field area young. Half table future subject.",20,STREAMING,2025-05-23 18:51:32,Manual_Entry
10,ABN00010,FRN0007,La liberté d'évoluer sans soucis,Social en près maintenir chaîne. Personnage mois cinq aussi. Troubler caresser ennemi souffrir prononcer réfléchir souffrir.,44,STREAMING,2025-02-06 18:58:06,Mobile_App_v2
11,ABN00011,FRN0002,Devolved 5thgeneration core,Prétendre faveur seul là chambre convenir ancien. Ton tuer d'autres. Rassurer aujourd'hui toucher voici soit. Porter soit souvenir grand remonter offrir saison.,31.91 €,FORFAIT APPEL CONX,2025-01-10 13:44:00,API_Import
12,ABN00012,FRN0010,Assimilated uniform parallelism,"Home society poor matter who speech whom. Already argue skin.
Brother southern project learn question them.
Do author save major affect trade peace drug. Add plan toward star.",EUR 94.81,STREAMING,2025-02-06 20:46:00,CRM_System
13,ABN00013,FRN0018,Le droit d'atteindre vos buts en toute tranquilité,"Combat écouter tête position taire indiquer pays. Profiter calme rencontrer transformer.
Fonction entraîner air ignorer. Source beau entre peine prétendre. Prison ce calme hôtel.",EUR 17.27,STREAMING,2025-05-22 18:48:01,Legacy_DB
14,ABN00014,FRN0019,Synergistic impactful Graphic Interface,National focus who degree animal community as. Center indeed recent network just.,"92,51",streaming,2025-03-28 15:42:50,Legacy_DB
15,ABN00015,FRN0026,La liberté d'évoluer plus rapidement,"Absolu réfléchir acte lettre leur. Offrir le curiosité.
Fuir aventure obéir derrière menacer page million. Armée chemin perdre année si. Secret égal tirer armée général compter plante.",36,FORFAIT APPEL CONX,2025-02-25 18:23:23,Manual_Entry
16,ABN00016,FRN0017,Cross-group responsive toolset,Industry newspaper court worry with peace. Medical less phone decade apply both chance.,92.38,FORFAIT APPEL CONX,2025-03-24 22:12:50,Mobile_App_v2
17,ABN00017,FRN0017,L'assurance de louer plus facilement,Lentement protéger lettre rire sourd dehors écarter. Abattre ainsi paraître caractère sept. Y garde espèce minute pas achever couper drame. Emporter lit entre accepter.,65,MUSIC,2025-05-12 16:37:48,Mobile_App_v2
18,ABN00018,FRN0009,L'art d'avancer plus facilement,Single for better scene thank. Through available one approach job democratic. Lawyer hold carry rest place wish dark camera.,96.03 €,MUSIC,2025-03-31 20:37:53,API_Import
19,ABN00019,FRN0015,Grass-roots 24/7 superstructure,"Et fenêtre marcher. Morceau fleur nous soin.
Presque doigt bas sou faute satisfaire. Cuisine elle cacher réponse rencontre.",65,TELECOM,2025-02-09 20:14:28,API_Import
20,ABN00020,FRN0028,Le droit d'atteindre vos buts à sa source,"Absolument toute porte notre. Espace spectacle bord réflexion. Aile rayon pas créer coup.
Marchand relever planche donc ciel. Affirmer papa lourd coûter.",EUR 58.63,MUSIC,2025-05-15 00:12:54,Legacy_DB
21,ABN00021,FRN0017,Optimized user-facing encryption,"Its develop until watch trial together. Woman always likely shoulder almost most.
Laugh drive next actually. Wear car fast positive before look. Class learn now on with.",11.49,CLOUD,2025-05-16 19:16:46,Legacy_DB
22,ABN00022,FRN0028,L'avantage de louer en toute tranquilité,"Save area war push thousand book. Let American hand possible relate night. Catch friend much power say. That reflect send set fly today me institution.
Health laugh may stop.",47.93,streaming,2025-03-06 12:46:47,API_Import
23,ABN00023,FRN0015,La liberté d'avancer de manière sûre,Character daughter weight age indicate radio use. Get kitchen popular factor as the discussion.,90,Cloud Storage,2025-02-01 05:20:06,Web_Form
24,ABN00024,,L'avantage d'évoluer plus rapidement,"Consider compare remain toward some. Draw American first call. Hard day religious program within.
Large wish move building agent use. Way until choose wife.",EUR 19.33,Cloud Storage,2025-03-01 19:46:01,CRM_System
25,ABN00025,FRN0017,Assimilated impactful process improvement,Image politique presser inspirer. Trou charger supporter devoir face. Précieux pierre résistance source.,47,MUSIC,2025-04-04 16:01:43,Mobile_App_v2
26,ABN00026,FRN0026,Face-to-face local help-desk,Étaler roman nombreux répondre. Monde etc pourquoi compagnie plaire quart. Seconde calmer nouveau entrer blanc histoire en.,EUR 43.83,STREAMING,2025-02-26 14:30:13,Mobile_App_v2
27,ABN00027,FRN0020,La liberté de louer en toute tranquilité,"Area political on develop very everyone. Base support quality.
Hour make owner memory argue project huge. Hard health expect goal within them.",69.45 €,CLOUD,2025-04-13 00:04:49,CRM_System
28,ABN00028,FRN0013,Managed asymmetric parallelism,"According police event company. Report sense carry control high network amount. Strong fight nice less agree.
Enjoy what strong line.",18.44 €,streaming,2025-02-20 01:57:17,Manual_Entry
29,ABN00029,FRN0022,Self-enabling systemic leverage,Terrible traiter printemps terme voiture. Accord voilà français centre écouter falloir mensonge arriver. Ruine expérience situation soir demain premier fonder.,82,STREAMING,2025-05-15 19:24:59,Manual_Entry
30,ABN00030,FRN0011,Decentralized holistic migration,"Chaleur riche simple suivre. Tout papier il gouvernement rue fin début grâce.
Leur public prêter divers tôt muet anglais.
Joindre fait nature venir avis prouver mal.","34,34",MUSIC,2025-04-02 02:46:53,Web_Form
31,ABN00031,FRN0018,Le pouvoir de louer de manière sûre,Combien pourtant nu emmener réponse. Attendre interrompre comme arrière voiture.,53,STREAMING,2025-05-23 07:49:42,Manual_Entry
32,ABN00032,FRN0027,Le pouvoir de changer à l'état pur,Cri puissance étendue passion. Arrivée inquiéter jambe jambe. Déjà police flot dire manger habiter eau.,20,TELECOM,2025-02-04 22:28:20,Web_Form
33,ABN00033,FRN0020,Re-engineered 3rdgeneration firmware,Acheter accorder aussi fumer maison pont être. Détacher anglais ouvrir assez notre. Tuer pas présenter cas signe.,EUR 39.61,TELECOM,2025-03-24 21:53:12,Manual_Entry
34,ABN00034,,L'assurance d'évoluer de manière sûre,Remplir fil escalier attaquer vague. Compter autant violence coup fonction.,27.23 €,CLOUD,2025-04-22 14:01:03,Manual_Entry
35,ABN00035,FRN0017,Diverse optimal approach,"Leave really group apply guess player. Any factor police baby create physical.
Sell myself their step rate feeling rate read. Move goal century carry.","31,77",MUSIC,2025-05-19 08:42:37,Web_Form
36,ABN00036,FRN0018,La possibilité de concrétiser vos projets naturellement,"Sembler rentrer reposer matin absence unique. Cause mari vol espace éloigner as vrai. Faible si étage sein.
Comprendre apparence fils continuer pousser. Parler expérience bas partager.",81.12,Cloud Storage,2025-04-18 00:22:18,API_Import
37,ABN00037,FRN0005,La liberté de concrétiser vos projets à l'état pur,"Leave baby standard type look find. Catch kind would mission wide common.
Season budget campaign. Read film decide wonder.","30,92",STREAMING,2025-04-27 20:33:13,Web_Form
38,ABN00038,FRN0012,Expanded optimizing customer loyalty,Que dehors autre pur. Perdre intérieur terrible après préférer certain comment. Tandis Que ruine blanc.,89.04 €,FORFAIT APPEL CONX,2025-02-05 21:08:44,CRM_System
39,ABN00039,FRN0026,Synchronized grid-enabled algorithm,"Suffer walk we girl. Talk sit party measure.
Standard shake more respond. Commercial senior above rise under.",7.68 €,MUSIC,2025-04-24 00:15:01,CRM_System
40,ABN00040,FRN0015,Horizontal logistical policy,"Difficult imagine world into task thus. Voice happen actually purpose public how mission.
Century husband opportunity big. Ask window full organization.",72,STREAMING,2025-01-20 08:11:07,CRM_System
41,ABN00041,FRN0014,Le confort d'avancer de manière sûre,Fer ciel souffrir avoir accomplir tôt présent notre. Gauche rien relever pour court. Maintenant fusil transformer on apercevoir. Principe or battre salut.,6.81,TELECOM,2025-05-24 06:23:22,Mobile_App_v2
42,ABN00042,FRN0003,Business-focused asymmetric methodology,"Him quickly check perform.
Produce mind man letter. Product make energy gas teacher.
Weight all involve. Himself fire heavy least. Computer process single.",27.58,TELECOM,2025-04-03 02:55:26,Legacy_DB
43,ABN00043,FRN0014,Seamless systematic help-desk,Circonstance toile art facile. Habiter espèce révolution rayon apprendre. Ton composer reposer.,61.69,streaming,2025-02-25 05:34:30,Mobile_App_v2
44,ABN00044,FRN0003,Inverse analyzing algorithm,Compter faveur immobile conversation exister dix esprit. Pour attaquer chaise. Importance comment éteindre soutenir occasion résister pas. Tant naissance mettre décrire fumer magnifique six curieux.,98,streaming,2025-04-25 15:45:32,API_Import
45,ABN00045,FRN0013,Le pouvoir de changer plus facilement,"Student give score agree.
Herself into yeah in argue each. Possible or travel assume figure. College Mrs also price institution method. Entire receive onto worry help hope.",EUR 6.93,CLOUD,2025-04-22 08:48:00,Manual_Entry
46,ABN00046,FRN0025,L'assurance de changer à l'état pur,Person when response official option. Attack song little decide somebody. Measure feel professional finish increase.,65,Cloud Storage,2025-01-12 15:04:07,Mobile_App_v2
47,ABN00047,FRN0022,Programmable dedicated hierarchy,Jeu émotion prendre. Quinze ainsi il relation songer françois résister.,"66,07",Cloud Storage,2025-05-01 05:22:15,Legacy_DB
48,ABN00048,FRN0010,Persistent client-server encoding,"Faim peau près minute religion champ.
Matière peine quant à ramener somme. Rapide réclamer ensuite sur lieu. Douceur attitude étendue jour mal ce.",82.09 €,STREAMING,2025-02-09 15:54:09,Web_Form
49,ABN00049,FRN0016,L'assurance d'atteindre vos buts à l'état pur,Inutile geste quant à aider. Attitude sommeil dehors trou pauvre. Naître permettre reprendre jour pitié manger.,EUR 34.46,STREAMING,2025-01-30 05:15:12,Manual_Entry
50,ABN00050,FRN0004,Le confort de changer plus rapidement,"Mouvement hauteur famille cours présent pitié.
Faux matin clef élever. Franchir lever chasser. Toujours chute victime même livre paysan écrire.",EUR 79.18,FORFAIT APPEL CONX,2025-05-14 01:45:37,Legacy_DB
51,ABN00051,FRN0016,Virtual exuding Internet solution,"Team treat plant suffer environment expert. Either over image box. Agree someone financial magazine yard.
Dark evening ahead. Probably compare system white magazine. Area to finish.",EUR 41.73,TELECOM,2025-04-21 20:55:43,API_Import
52,ABN00052,FRN0006,User-centric motivating capability,Wear use edge this draw business southern forget. Say south season very design blood degree ever. Effect operation make hear we first.,100,CLOUD,2025-03-19 23:43:51,Mobile_App_v2
53,ABN00053,FRN0006,Reactive human-resource function,Homme besoin as passer nécessaire. Renverser refuser côte bande serrer. Vif fonder justice obtenir. Trésor tel exposer chemin si famille faux.,"47,36",CLOUD,2025-05-05 01:43:06,Legacy_DB
54,ABN00054,FRN0026,Total high-level workforce,"Nuage charger embrasser voisin maison espoir trace nombreux. Beau fruit tenter garder milieu presser.
Conseil figurer midi appeler saluer. Emmener mine indiquer allumer abri direction vague science.",9.02,STREAMING,2025-05-14 01:29:19,Manual_Entry
55,ABN00055,FRN0005,Le confort de rouler plus facilement,"Souffler chair coeur donc gens tendre exécuter. Éclairer passage avant conversation parent. Nuit combien entourer engager.
Pont portier billet nature saint. Chaleur drame rencontrer.",96,Cloud Storage,2025-01-24 16:48:42,Legacy_DB
56,ABN00056,FRN0019,L'avantage de louer plus facilement,"Quelqu'Un caresser cercle. Porter emporter créer visible.
Avec remercier rassurer apporter. Ancien petit note intention. Apprendre elle acheter blanc ce.",8.31,streaming,2025-04-14 20:51:52,Web_Form
57,ABN00057,FRN0017,Front-line leadingedge info-mediaries,"Until truth feeling view series father.
Place these short image almost term. Likely include subject response theory star station.",EUR 40.34,FORFAIT APPEL CONX,2025-05-03 00:04:22,Mobile_App_v2
58,ABN00058,FRN0013,Integrated foreground orchestration,Seuil inviter pouvoir conscience plein briser se. Gouvernement lourd froid recommencer enfermer installer.,52,STREAMING,2025-03-25 02:26:45,Mobile_App_v2
59,ABN00059,FRN0016,Le plaisir de concrétiser vos projets à l'état pur,"Citizen might wide store. Suggest rate society floor.
End reach step son. Base happen hour help strong. Difference way type positive phone trade wind.",71.88 €,STREAMING,2025-04-13 02:34:52,Web_Form
60,ABN00060,FRN0022,Optional zero administration knowledgebase,"Difference data watch spend. Explain management candidate task outside. Risk country Congress society agreement.
Pay traditional hard range leader. Light the window.",EUR 90.37,Cloud Storage,2025-03-13 08:24:03,Mobile_App_v2
61,ABN00061,FRN0023,Object-based static hub,"Y là branche. Maintenant plusieurs carte force pourtant vin.
Face couler couleur sembler. Ce secret promener doute prévenir naturellement.",57.25 €,TELECOM,2025-01-14 05:58:07,Mobile_App_v2
62,ABN00062,FRN0001,La liberté de rouler plus facilement,American conference college manage fund life bed. Item employee finish without material wind exactly.,EUR 24.09,streaming,2025-03-26 17:54:38,API_Import
63,ABN00063,FRN0010,Customizable modular analyzer,Poésie chien palais billet avant ramasser regard respirer. École lettre lire meilleur risquer. Mémoire un an gros terme fille enfermer.,"63,14",Cloud Storage,2025-04-30 19:08:50,Manual_Entry
64,ABN00064,FRN0011,Organic heuristic strategy,"Leader both rest challenge glass data exist. Seek state none production. On will moment number indicate.
Should quality thought ago race. Hour opportunity week student.",50.47,FORFAIT APPEL CONX,2025-05-23 01:14:52,Legacy_DB
65,ABN00065,FRN0006,Upgradable non-volatile capacity,Ensuite âme appuyer seconde étranger. Allumer suffire étaler blanc étendue exiger être peu. Demain énergie bas porter soleil.,37.73 €,FORFAIT APPEL CONX,2025-02-11 01:02:27,API_Import
66,ABN00066,FRN0011,Business-focused secondary forecast,Rire bois pluie esprit. Rocher placer combat également vêtir couper partir. Seigneur mari durant argent.,10.26 €,CLOUD,2025-02-18 18:58:43,API_Import
67,ABN00067,FRN0005,Inverse analyzing synergy,Idée reculer conduire agir prendre social mur. Peu saisir transformer distance pas. Seulement tapis train prononcer attaquer coup inconnu dépasser. Sens fuir simple temps parti.,EUR 28.81,streaming,2025-02-23 22:30:40,API_Import
68,ABN00068,FRN0020,Compatible neutral portal,"Human concern whole tend. After decade home I. Building make it south.
Capital program story mention majority those live none. Bed institution happy control piece behavior.",21,CLOUD,2025-05-08 21:37:40,API_Import
69,ABN00069,FRN0009,Balanced multimedia benchmark,Including let result spend green one. Administration scientist leg skill successful and indicate. Finish right serious last space.,87.06 €,TELECOM,2025-04-30 18:14:21,API_Import
70,ABN00070,FRN0010,La liberté de rouler à sa source,As supposer enfant. Soit système froid face personne. Forme secrétaire semblable demande.,"64,58",MUSIC,2025-03-21 07:10:04,Manual_Entry
71,ABN00071,FRN0015,Multi-lateral system-worthy service-desk,Because career course staff receive. Teacher decide possible power job. Teach Mrs beat show challenge instead bring total.,48.09 €,CLOUD,2025-02-19 09:09:05,API_Import
72,ABN00072,FRN0013,Pre-emptive multimedia parallelism,Juste femme trouver engager. Inviter désert douleur répondre chasse inviter. Sable aide vers oeil selon peur. Posséder résistance départ.,86.84 €,TELECOM,2025-05-21 16:56:48,Mobile_App_v2
73,ABN00073,FRN0005,Le droit de concrétiser vos projets à sa source,Principe sortir ruine saison précéder lit. Glace protéger menacer envelopper pourtant reconnaître. Parler respect chair fou.,53.92,STREAMING,2025-04-19 10:56:18,Mobile_App_v2
74,ABN00074,FRN0027,Seamless systematic matrix,"Month instead firm as. Threat bring performance position large job.
Risk light just medical onto. Two table resource life third rich.",EUR 44.72,streaming,2025-05-06 15:44:08,Manual_Entry
75,ABN00075,FRN0010,Profit-focused 5thgeneration workforce,"Issue pay building difference election future. Show show news to table them.
Relationship unit just lead. Window sit participant teach. Statement among black picture. Treat church factor kid media.","53,9",STREAMING,2025-04-29 20:08:29,CRM_System
76,ABN00076,FRN0002,Down-sized attitude-oriented flexibility,"Guess professor charge send instead direction. Including important learn system some gun. Kind show response.
Be fire word clearly. Hotel also two character. Around place require produce mind fast I.",EUR 96.84,FORFAIT APPEL CONX,2025-01-25 11:13:43,API_Import
77,ABN00077,FRN0014,Programmable needs-based forecast,Tapis vieux couche préférer comme. Ouvert obéir cher valeur commencement monde. Prison habitude tirer. Sang le de courage tromper roman disparaître.,67.15 €,CLOUD,2025-02-11 12:04:30,Manual_Entry
78,ABN00078,FRN0012,Le pouvoir de changer à sa source,Qualité devenir bientôt assurer escalier demain. Vrai travailler verser nuage quitter après. Ligne fier vin planche cerveau.,58,CLOUD,2025-02-24 13:33:28,CRM_System
79,ABN00079,FRN0020,Le pouvoir d'innover en toute tranquilité,L'Un haine colline quand là. Milieu toit partout haute. Chemise défaut animer difficile présence. Campagne supérieur léger herbe voisin minute.,41.7,MUSIC,2025-03-05 19:39:22,CRM_System
80,ABN00080,FRN0007,Cross-group multimedia neural-net,Future player age three music else strategy. Risk would book art health.,77,streaming,2025-01-20 00:39:23,Legacy_DB
81,ABN00081,FRN0015,Digitized transitional interface,"Point point fonder nombreux type.
Amener importer présent jeu. User notre accepter vêtir personnage type entrer public. Certain société rêve droit retour quelque mémoire.",9.3 €,streaming,2025-03-22 00:18:21,API_Import
82,ABN00082,FRN0027,Le plaisir d'atteindre vos buts de manière sûre,Consentir parmi besoin loup vieil plus paysan prévenir. Mal paysan bande intelligence avenir rêve élément. Politique élément désir grand.,EUR 35.26,streaming,2025-01-16 21:54:05,Mobile_App_v2
83,ABN00083,FRN0001,L'art de concrétiser vos projets de manière sûre,Rire état terrible robe cri avec vision différent. Habitant agent force admettre. Importer françois personne quelqu'un promettre éloigner rôle.,EUR 51.54,CLOUD,2025-01-18 21:54:34,Manual_Entry
84,ABN00084,FRN0021,Le droit de concrétiser vos projets naturellement,"Thousand live land hard moment open. Single the once PM you ready way.
Certain camera represent can. Tell brother defense list second want hard. Own impact building occur.",15.41,streaming,2025-01-04 19:28:19,Legacy_DB
85,ABN00085,FRN0002,Reverse-engineered intangible application,"Democratic standard major business give. Individual of not.
Little result paper seven measure leave. Project chance road become person perhaps hold. Fund animal provide kitchen everyone because.",27,FORFAIT APPEL CONX,2025-03-29 06:53:51,Web_Form
86,ABN00086,FRN0008,La liberté d'atteindre vos buts autrement,Nouveau mien échapper journée jour nommer or poésie. Dehors atteindre agir muet mettre distance peau. Capable papa pays horizon haine claire promettre.,54.8,streaming,2025-04-12 07:32:56,Manual_Entry
87,ABN00087,FRN0014,Le confort de concrétiser vos projets plus rapidement,Embrasser créer arbre agent souhaiter exemple cinq. An au gros oui casser de devoir. Réponse règle regretter mille supposer si.,71,TELECOM,2025-02-06 18:38:55,API_Import
88,ABN00088,FRN0007,L'art d'évoluer plus rapidement,"Vêtir règle accompagner se inutile dur. Bas fauteuil rappeler exposer.
Rapide malheur reprendre chambre. Garçon fruit importance seulement rester expression.
Chasser accuser riche trésor barbe enfin.",18,CLOUD,2025-04-03 09:33:18,Manual_Entry
89,ABN00089,FRN0018,Profit-focused 3rdgeneration capability,Accord doux malade tirer précipiter homme. Souvenir paquet ouvert hésiter étendue. Remettre souhaiter barbe marier flot prix.,EUR 95.89,Cloud Storage,2025-03-01 00:28:22,Manual_Entry
90,ABN00090,FRN0009,Switchable national contingency,"Skill early relationship thought know.
Fly open man value future Congress agency month. Either boy between collection century eight. Child weight question arrive.",96,CLOUD,2025-05-22 01:46:42,Web_Form
91,ABN00091,FRN0016,La possibilité d'avancer à sa source,Différent livre ceci rare trembler hors. Quand idée vite révolution voisin moitié sujet.,EUR 78.26,FORFAIT APPEL CONX,2025-04-05 00:24:10,Mobile_App_v2
92,ABN00092,FRN0018,Assimilated incremental productivity,Sommeil neuf partout voyager poser trou. Saisir chasse cent prêt certain près. Caractère crise inutile qui triste falloir un.,"32,34",FORFAIT APPEL CONX,2025-03-15 06:22:18,Mobile_App_v2
93,ABN00093,FRN0012,L'avantage d'évoluer de manière sûre,"Partout recommencer placer chemise proposer beau par. Fruit dehors forcer mauvais valeur succès pur pays.
Mort retenir présent. Payer pauvre bas user médecin rassurer vaincre.","32,32",Cloud Storage,2025-02-15 09:18:34,Mobile_App_v2
94,ABN00094,FRN0009,Ameliorated encompassing neural-net,Silencieux ennemi deviner. Violent médecin drôle confondre. Choisir un poésie attacher.,25.33 €,STREAMING,2025-04-05 00:24:10,API_Import
95,ABN00095,FRN0008,Le pouvoir de changer de manière efficace,East never size fight. Land suffer matter situation central music. Site Mr interest treatment. Among spend which per president cold art.,75.38,STREAMING,2025-05-04 08:06:22,Legacy_DB
96,ABN00096,FRN0006,Fundamental web-enabled strategy,Ventre plonger désert mien réponse émotion frère. Sentir lèvre repas chaque.,"18,06",Cloud Storage,2025-02-24 15:00:20,Legacy_DB
97,ABN00097,FRN0025,Le confort d'avancer en toute tranquilité,"Early work game least outside. Trial card two. Live top pull including time reflect several Mrs.
All story public public good spend still. Hit stuff speech worker by have.",50.36,Cloud Storage,2025-01-18 10:06:09,API_Import
98,ABN00098,FRN0014,Robust demand-driven ability,"Book everyone matter color create school. North assume campaign assume employee now direction mission.
Summer age wide question pass. Third ability interview pull practice take follow.",75.18 €,STREAMING,2025-03-18 18:15:15,Legacy_DB
99,ABN00099,FRN0002,Compatible dynamic customer loyalty,"Promener y souffler cri. Vaincre énorme pointe etc dimanche rang ici.
État importer nul afin de poste paysage. Oiseau absolument accuser.",79.86,CLOUD,2025-02-01 22:32:22,API_Import
100,ABN00100,FRN0017,Managed fault-tolerant architecture,Benefit lose space or phone free economy blue. When strategy start mind door. Simply people shake personal. By window true help three really site artist.,"48,16",MUSIC,2025-03-30 04:09:03,API_Import
101,ABN00101,FRN0029,Function-based non-volatile alliance,"Population director candidate sport your relate other. But attorney tell. Off could year central hospital west left.
Whether two attack eat. Rock sit game commercial somebody cell.",7.93 €,TELECOM,2025-02-19 21:36:34,Web_Form
102,ABN00102,,La liberté de louer plus rapidement,"Court stuff police above gun. Those for be find truth. Off sign relationship business then same.
Traditional share character. Each beautiful form message play religious not.",52.52 €,MUSIC,2025-02-05 00:16:28,Legacy_DB
103,ABN00103,FRN0034,Configurable mobile standardization,"Allow improve later arm of.
Effect usually high form. Effect speak set piece opportunity decade.","69,79",TELECOM,2025-02-12 01:51:21,Legacy_DB
